"No.","Time","Source","Destination","Protocol","Length","Info"
"10","2.977325","192.168.0.214","192.168.0.200","TCP","1078","5001  >  59066 [PSH, ACK] Seq=1 Ack=1 Win=2048 Len=1024"
"11","2.977984","192.168.0.214","192.168.0.200","TCP","1078","5001  >  59066 [PSH, ACK] Seq=1025 Ack=1 Win=2048 Len=1024"
"13","2.979927","192.168.0.214","192.168.0.200","TCP","1078","5001  >  59066 [PSH, ACK] Seq=2049 Ack=1 Win=2048 Len=1024"
"14","2.981125","192.168.0.214","192.168.0.200","TCP","1078","5001  >  59066 [PSH, ACK] Seq=3073 Ack=1 Win=2048 Len=1024"
"16","2.983461","192.168.0.214","192.168.0.200","TCP","1078","5001  >  59066 [PSH, ACK] Seq=4097 Ack=1 Win=2048 Len=1024"
"17","2.984102","192.168.0.214","192.168.0.200","TCP","1078","5001  >  59066 [PSH, ACK] Seq=5121 Ack=1 Win=2048 Len=1024"
"19","2.985912","192.168.0.214","192.168.0.200","TCP","1078","5001  >  59066 [PSH, ACK] Seq=6145 Ack=1 Win=2048 Len=1024"
"20","2.987118","192.168.0.214","192.168.0.200","TCP","1078","5001  >  59066 [PSH, ACK] Seq=7169 Ack=1 Win=2048 Len=1024"
"22","2.989311","192.168.0.214","192.168.0.200","TCP","1078","5001  >  59066 [PSH, ACK] Seq=8193 Ack=1 Win=2048 Len=1024"
"23","2.989984","192.168.0.214","192.168.0.200","TCP","1078","5001  >  59066 [PSH, ACK] Seq=9217 Ack=1 Win=2048 Len=1024"
"25","2.991972","192.168.0.214","192.168.0.200","TCP","1078","5001  >  59066 [PSH, ACK] Seq=10241 Ack=1 Win=2048 Len=1024"
"26","2.992934","192.168.0.214","192.168.0.200","TCP","1078","5001  >  59066 [PSH, ACK] Seq=11265 Ack=1 Win=2048 Len=1024"
"28","2.994820","192.168.0.214","192.168.0.200","TCP","1078","5001  >  59066 [PSH, ACK] Seq=12289 Ack=1 Win=2048 Len=1024"
"29","2.995963","192.168.0.214","192.168.0.200","TCP","1078","5001  >  59066 [PSH, ACK] Seq=13313 Ack=1 Win=2048 Len=1024"
"31","2.998329","192.168.0.214","192.168.0.200","TCP","1078","5001  >  59066 [PSH, ACK] Seq=14337 Ack=1 Win=2048 Len=1024"
"32","2.999107","192.168.0.214","192.168.0.200","TCP","1078","5001  >  59066 [PSH, ACK] Seq=15361 Ack=1 Win=2048 Len=1024"
"34","3.001391","192.168.0.214","192.168.0.200","TCP","1078","5001  >  59066 [PSH, ACK] Seq=16385 Ack=1 Win=2048 Len=1024"
"35","3.002137","192.168.0.214","192.168.0.200","TCP","1078","5001  >  59066 [PSH, ACK] Seq=17409 Ack=1 Win=2048 Len=1024"
"37","3.004469","192.168.0.214","192.168.0.200","TCP","1078","5001  >  59066 [PSH, ACK] Seq=18433 Ack=1 Win=2048 Len=1024"
"38","3.005193","192.168.0.214","192.168.0.200","TCP","1078","5001  >  59066 [PSH, ACK] Seq=19457 Ack=1 Win=2048 Len=1024"
"40","3.007606","192.168.0.214","192.168.0.200","TCP","1078","5001  >  59066 [PSH, ACK] Seq=20481 Ack=1 Win=2048 Len=1024"
"41","3.008501","192.168.0.214","192.168.0.200","TCP","1078","5001  >  59066 [PSH, ACK] Seq=21505 Ack=1 Win=2048 Len=1024"
"43","3.010713","192.168.0.214","192.168.0.200","TCP","1078","5001  >  59066 [PSH, ACK] Seq=22529 Ack=1 Win=2048 Len=1024"
"44","3.011427","192.168.0.214","192.168.0.200","TCP","1078","5001  >  59066 [PSH, ACK] Seq=23553 Ack=1 Win=2048 Len=1024"
"46","3.013680","192.168.0.214","192.168.0.200","TCP","1078","5001  >  59066 [PSH, ACK] Seq=24577 Ack=1 Win=2048 Len=1024"
"47","3.014374","192.168.0.214","192.168.0.200","TCP","1078","5001  >  59066 [PSH, ACK] Seq=25601 Ack=1 Win=2048 Len=1024"
"49","3.016289","192.168.0.214","192.168.0.200","TCP","1078","5001  >  59066 [PSH, ACK] Seq=26625 Ack=1 Win=2048 Len=1024"
"50","3.017677","192.168.0.214","192.168.0.200","TCP","1078","5001  >  59066 [PSH, ACK] Seq=27649 Ack=1 Win=2048 Len=1024"
"52","3.019918","192.168.0.214","192.168.0.200","TCP","1078","5001  >  59066 [PSH, ACK] Seq=28673 Ack=1 Win=2048 Len=1024"
"53","3.020608","192.168.0.214","192.168.0.200","TCP","1078","5001  >  59066 [PSH, ACK] Seq=29697 Ack=1 Win=2048 Len=1024"
"55","3.022677","192.168.0.214","192.168.0.200","TCP","1078","5001  >  59066 [PSH, ACK] Seq=30721 Ack=1 Win=2048 Len=1024"
"56","3.023532","192.168.0.214","192.168.0.200","TCP","1078","5001  >  59066 [PSH, ACK] Seq=31745 Ack=1 Win=2048 Len=1024"
"58","3.025639","192.168.0.214","192.168.0.200","TCP","1078","5001  >  59066 [PSH, ACK] Seq=32769 Ack=1 Win=2048 Len=1024"
"59","3.026299","192.168.0.214","192.168.0.200","TCP","1078","5001  >  59066 [PSH, ACK] Seq=33793 Ack=1 Win=2048 Len=1024"
"61","3.028309","192.168.0.214","192.168.0.200","TCP","1078","5001  >  59066 [PSH, ACK] Seq=34817 Ack=1 Win=2048 Len=1024"
"62","3.029145","192.168.0.214","192.168.0.200","TCP","1078","5001  >  59066 [PSH, ACK] Seq=35841 Ack=1 Win=2048 Len=1024"
"64","3.031181","192.168.0.214","192.168.0.200","TCP","1078","5001  >  59066 [PSH, ACK] Seq=36865 Ack=1 Win=2048 Len=1024"
"65","3.032056","192.168.0.214","192.168.0.200","TCP","1078","5001  >  59066 [PSH, ACK] Seq=37889 Ack=1 Win=2048 Len=1024"
"67","3.034082","192.168.0.214","192.168.0.200","TCP","1078","5001  >  59066 [PSH, ACK] Seq=38913 Ack=1 Win=2048 Len=1024"
"68","3.034906","192.168.0.214","192.168.0.200","TCP","1078","5001  >  59066 [PSH, ACK] Seq=39937 Ack=1 Win=2048 Len=1024"
"70","3.037237","192.168.0.214","192.168.0.200","TCP","1078","5001  >  59066 [PSH, ACK] Seq=40961 Ack=1 Win=2048 Len=1024"
"71","3.037865","192.168.0.214","192.168.0.200","TCP","1078","5001  >  59066 [PSH, ACK] Seq=41985 Ack=1 Win=2048 Len=1024"
"73","3.039154","192.168.0.214","192.168.0.200","TCP","1078","5001  >  59066 [PSH, ACK] Seq=43009 Ack=1 Win=2048 Len=1024"
"74","3.040470","192.168.0.214","192.168.0.200","TCP","1078","5001  >  59066 [PSH, ACK] Seq=44033 Ack=1 Win=2048 Len=1024"
"76","3.042675","192.168.0.214","192.168.0.200","TCP","1078","5001  >  59066 [PSH, ACK] Seq=45057 Ack=1 Win=2048 Len=1024"
"77","3.043308","192.168.0.214","192.168.0.200","TCP","1078","5001  >  59066 [PSH, ACK] Seq=46081 Ack=1 Win=2048 Len=1024"
"79","3.044752","192.168.0.214","192.168.0.200","TCP","1078","5001  >  59066 [PSH, ACK] Seq=47105 Ack=1 Win=2048 Len=1024"
"80","3.045767","192.168.0.214","192.168.0.200","TCP","1078","5001  >  59066 [PSH, ACK] Seq=48129 Ack=1 Win=2048 Len=1024"
"82","3.047666","192.168.0.214","192.168.0.200","TCP","1078","5001  >  59066 [PSH, ACK] Seq=49153 Ack=1 Win=2048 Len=1024"
"83","3.048693","192.168.0.214","192.168.0.200","TCP","1078","5001  >  59066 [PSH, ACK] Seq=50177 Ack=1 Win=2048 Len=1024"
"85","3.050556","192.168.0.214","192.168.0.200","TCP","1078","5001  >  59066 [PSH, ACK] Seq=51201 Ack=1 Win=2048 Len=1024"
"86","3.052129","192.168.0.214","192.168.0.200","TCP","1078","5001  >  59066 [PSH, ACK] Seq=52225 Ack=1 Win=2048 Len=1024"
"88","3.054289","192.168.0.214","192.168.0.200","TCP","1078","5001  >  59066 [PSH, ACK] Seq=53249 Ack=1 Win=2048 Len=1024"
"89","3.054920","192.168.0.214","192.168.0.200","TCP","1078","5001  >  59066 [PSH, ACK] Seq=54273 Ack=1 Win=2048 Len=1024"
"91","3.056526","192.168.0.214","192.168.0.200","TCP","1078","5001  >  59066 [PSH, ACK] Seq=55297 Ack=1 Win=2048 Len=1024"
"92","3.057176","192.168.0.214","192.168.0.200","TCP","1078","5001  >  59066 [PSH, ACK] Seq=56321 Ack=1 Win=2048 Len=1024"
"94","3.058717","192.168.0.214","192.168.0.200","TCP","1078","5001  >  59066 [PSH, ACK] Seq=57345 Ack=1 Win=2048 Len=1024"
"95","3.059368","192.168.0.214","192.168.0.200","TCP","1078","5001  >  59066 [PSH, ACK] Seq=58369 Ack=1 Win=2048 Len=1024"
"97","3.061378","192.168.0.214","192.168.0.200","TCP","1078","5001  >  59066 [PSH, ACK] Seq=59393 Ack=1 Win=2048 Len=1024"
"98","3.062171","192.168.0.214","192.168.0.200","TCP","1078","5001  >  59066 [PSH, ACK] Seq=60417 Ack=1 Win=2048 Len=1024"
"100","3.064100","192.168.0.214","192.168.0.200","TCP","1078","5001  >  59066 [PSH, ACK] Seq=61441 Ack=1 Win=2048 Len=1024"
"101","3.065361","192.168.0.214","192.168.0.200","TCP","1078","5001  >  59066 [PSH, ACK] Seq=62465 Ack=1 Win=2048 Len=1024"
"103","3.067585","192.168.0.214","192.168.0.200","TCP","1078","5001  >  59066 [PSH, ACK] Seq=63489 Ack=1 Win=2048 Len=1024"
"104","3.068228","192.168.0.214","192.168.0.200","TCP","1078","5001  >  59066 [PSH, ACK] Seq=64513 Ack=1 Win=2048 Len=1024"
"106","3.069658","192.168.0.214","192.168.0.200","TCP","1078","5001  >  59066 [PSH, ACK] Seq=65537 Ack=1 Win=2048 Len=1024"
"107","3.070481","192.168.0.214","192.168.0.200","TCP","1078","5001  >  59066 [PSH, ACK] Seq=66561 Ack=1 Win=2048 Len=1024"
"109","3.072612","192.168.0.214","192.168.0.200","TCP","1078","5001  >  59066 [PSH, ACK] Seq=67585 Ack=1 Win=2048 Len=1024"
"110","3.073430","192.168.0.214","192.168.0.200","TCP","1078","5001  >  59066 [PSH, ACK] Seq=68609 Ack=1 Win=2048 Len=1024"
"112","3.074743","192.168.0.214","192.168.0.200","TCP","1078","5001  >  59066 [PSH, ACK] Seq=69633 Ack=1 Win=2048 Len=1024"
"113","3.076322","192.168.0.214","192.168.0.200","TCP","1078","5001  >  59066 [PSH, ACK] Seq=70657 Ack=1 Win=2048 Len=1024"
"115","3.078494","192.168.0.214","192.168.0.200","TCP","1078","5001  >  59066 [PSH, ACK] Seq=71681 Ack=1 Win=2048 Len=1024"
"116","3.079135","192.168.0.214","192.168.0.200","TCP","1078","5001  >  59066 [PSH, ACK] Seq=72705 Ack=1 Win=2048 Len=1024"
"118","3.080747","192.168.0.214","192.168.0.200","TCP","1078","5001  >  59066 [PSH, ACK] Seq=73729 Ack=1 Win=2048 Len=1024"
"119","3.081789","192.168.0.214","192.168.0.200","TCP","1078","5001  >  59066 [PSH, ACK] Seq=74753 Ack=1 Win=2048 Len=1024"
"121","3.083952","192.168.0.214","192.168.0.200","TCP","1078","5001  >  59066 [PSH, ACK] Seq=75777 Ack=1 Win=2048 Len=1024"
"122","3.084550","192.168.0.214","192.168.0.200","TCP","1078","5001  >  59066 [PSH, ACK] Seq=76801 Ack=1 Win=2048 Len=1024"
"124","3.086074","192.168.0.214","192.168.0.200","TCP","1078","5001  >  59066 [PSH, ACK] Seq=77825 Ack=1 Win=2048 Len=1024"
"125","3.087330","192.168.0.214","192.168.0.200","TCP","1078","5001  >  59066 [PSH, ACK] Seq=78849 Ack=1 Win=2048 Len=1024"
"127","3.089494","192.168.0.214","192.168.0.200","TCP","1078","5001  >  59066 [PSH, ACK] Seq=79873 Ack=1 Win=2048 Len=1024"
"128","3.090097","192.168.0.214","192.168.0.200","TCP","1078","5001  >  59066 [PSH, ACK] Seq=80897 Ack=1 Win=2048 Len=1024"
"130","3.091611","192.168.0.214","192.168.0.200","TCP","1078","5001  >  59066 [PSH, ACK] Seq=81921 Ack=1 Win=2048 Len=1024"
"131","3.092397","192.168.0.214","192.168.0.200","TCP","1078","5001  >  59066 [PSH, ACK] Seq=82945 Ack=1 Win=2048 Len=1024"
"133","3.094448","192.168.0.214","192.168.0.200","TCP","1078","5001  >  59066 [PSH, ACK] Seq=83969 Ack=1 Win=2048 Len=1024"
"134","3.095269","192.168.0.214","192.168.0.200","TCP","1078","5001  >  59066 [PSH, ACK] Seq=84993 Ack=1 Win=2048 Len=1024"
"136","3.097263","192.168.0.214","192.168.0.200","TCP","1078","5001  >  59066 [PSH, ACK] Seq=86017 Ack=1 Win=2048 Len=1024"
"137","3.098052","192.168.0.214","192.168.0.200","TCP","1078","5001  >  59066 [PSH, ACK] Seq=87041 Ack=1 Win=2048 Len=1024"
"139","3.100035","192.168.0.214","192.168.0.200","TCP","1078","5001  >  59066 [PSH, ACK] Seq=88065 Ack=1 Win=2048 Len=1024"
"140","3.100860","192.168.0.214","192.168.0.200","TCP","1078","5001  >  59066 [PSH, ACK] Seq=89089 Ack=1 Win=2048 Len=1024"
"142","3.102992","192.168.0.214","192.168.0.200","TCP","1078","5001  >  59066 [PSH, ACK] Seq=90113 Ack=1 Win=2048 Len=1024"
"143","3.104155","192.168.0.214","192.168.0.200","TCP","1078","5001  >  59066 [PSH, ACK] Seq=91137 Ack=1 Win=2048 Len=1024"
"145","3.106496","192.168.0.214","192.168.0.200","TCP","1078","5001  >  59066 [PSH, ACK] Seq=92161 Ack=1 Win=2048 Len=1024"
"146","3.107301","192.168.0.214","192.168.0.200","TCP","1078","5001  >  59066 [PSH, ACK] Seq=93185 Ack=1 Win=2048 Len=1024"
"148","3.108554","192.168.0.214","192.168.0.200","TCP","1078","5001  >  59066 [PSH, ACK] Seq=94209 Ack=1 Win=2048 Len=1024"
"149","3.109473","192.168.0.214","192.168.0.200","TCP","1078","5001  >  59066 [PSH, ACK] Seq=95233 Ack=1 Win=2048 Len=1024"
"151","3.110621","192.168.0.214","192.168.0.200","TCP","1078","5001  >  59066 [PSH, ACK] Seq=96257 Ack=1 Win=2048 Len=1024"
"152","3.111665","192.168.0.214","192.168.0.200","TCP","1078","5001  >  59066 [PSH, ACK] Seq=97281 Ack=1 Win=2048 Len=1024"
"154","3.112816","192.168.0.214","192.168.0.200","TCP","1078","5001  >  59066 [PSH, ACK] Seq=98305 Ack=1 Win=2048 Len=1024"
"155","3.113876","192.168.0.214","192.168.0.200","TCP","1078","5001  >  59066 [PSH, ACK] Seq=99329 Ack=1 Win=2048 Len=1024"
"157","3.115027","192.168.0.214","192.168.0.200","TCP","1078","5001  >  59066 [PSH, ACK] Seq=100353 Ack=1 Win=2048 Len=1024"
"158","3.116069","192.168.0.214","192.168.0.200","TCP","1078","5001  >  59066 [PSH, ACK] Seq=101377 Ack=1 Win=2048 Len=1024"
"160","3.117216","192.168.0.214","192.168.0.200","TCP","1078","5001  >  59066 [PSH, ACK] Seq=102401 Ack=1 Win=2048 Len=1024"
"161","3.118274","192.168.0.214","192.168.0.200","TCP","1078","5001  >  59066 [PSH, ACK] Seq=103425 Ack=1 Win=2048 Len=1024"
"163","3.119418","192.168.0.214","192.168.0.200","TCP","1078","5001  >  59066 [PSH, ACK] Seq=104449 Ack=1 Win=2048 Len=1024"
"164","3.120482","192.168.0.214","192.168.0.200","TCP","1078","5001  >  59066 [PSH, ACK] Seq=105473 Ack=1 Win=2048 Len=1024"
"166","3.121629","192.168.0.214","192.168.0.200","TCP","1078","5001  >  59066 [PSH, ACK] Seq=106497 Ack=1 Win=2048 Len=1024"
"167","3.122694","192.168.0.214","192.168.0.200","TCP","1078","5001  >  59066 [PSH, ACK] Seq=107521 Ack=1 Win=2048 Len=1024"
"169","3.123845","192.168.0.214","192.168.0.200","TCP","1078","5001  >  59066 [PSH, ACK] Seq=108545 Ack=1 Win=2048 Len=1024"
"170","3.124899","192.168.0.214","192.168.0.200","TCP","1078","5001  >  59066 [PSH, ACK] Seq=109569 Ack=1 Win=2048 Len=1024"
"172","3.126028","192.168.0.214","192.168.0.200","TCP","1078","5001  >  59066 [PSH, ACK] Seq=110593 Ack=1 Win=2048 Len=1024"
"173","3.127087","192.168.0.214","192.168.0.200","TCP","1078","5001  >  59066 [PSH, ACK] Seq=111617 Ack=1 Win=2048 Len=1024"
"175","3.128230","192.168.0.214","192.168.0.200","TCP","1078","5001  >  59066 [PSH, ACK] Seq=112641 Ack=1 Win=2048 Len=1024"
"176","3.129290","192.168.0.214","192.168.0.200","TCP","1078","5001  >  59066 [PSH, ACK] Seq=113665 Ack=1 Win=2048 Len=1024"
"178","3.130435","192.168.0.214","192.168.0.200","TCP","1078","5001  >  59066 [PSH, ACK] Seq=114689 Ack=1 Win=2048 Len=1024"
"179","3.131486","192.168.0.214","192.168.0.200","TCP","1078","5001  >  59066 [PSH, ACK] Seq=115713 Ack=1 Win=2048 Len=1024"
"181","3.132659","192.168.0.214","192.168.0.200","TCP","1078","5001  >  59066 [PSH, ACK] Seq=116737 Ack=1 Win=2048 Len=1024"
"182","3.133698","192.168.0.214","192.168.0.200","TCP","1078","5001  >  59066 [PSH, ACK] Seq=117761 Ack=1 Win=2048 Len=1024"
"184","3.134836","192.168.0.214","192.168.0.200","TCP","1078","5001  >  59066 [PSH, ACK] Seq=118785 Ack=1 Win=2048 Len=1024"
"185","3.135900","192.168.0.214","192.168.0.200","TCP","1078","5001  >  59066 [PSH, ACK] Seq=119809 Ack=1 Win=2048 Len=1024"
"187","3.137063","192.168.0.214","192.168.0.200","TCP","1078","5001  >  59066 [PSH, ACK] Seq=120833 Ack=1 Win=2048 Len=1024"
"188","3.138119","192.168.0.214","192.168.0.200","TCP","1078","5001  >  59066 [PSH, ACK] Seq=121857 Ack=1 Win=2048 Len=1024"
"190","3.139348","192.168.0.214","192.168.0.200","TCP","1078","5001  >  59066 [PSH, ACK] Seq=122881 Ack=1 Win=2048 Len=1024"
"191","3.140384","192.168.0.214","192.168.0.200","TCP","1078","5001  >  59066 [PSH, ACK] Seq=123905 Ack=1 Win=2048 Len=1024"
"193","3.141521","192.168.0.214","192.168.0.200","TCP","1078","5001  >  59066 [PSH, ACK] Seq=124929 Ack=1 Win=2048 Len=1024"
"194","3.142600","192.168.0.214","192.168.0.200","TCP","1078","5001  >  59066 [PSH, ACK] Seq=125953 Ack=1 Win=2048 Len=1024"
"196","3.143728","192.168.0.214","192.168.0.200","TCP","1078","5001  >  59066 [PSH, ACK] Seq=126977 Ack=1 Win=2048 Len=1024"
"197","3.144785","192.168.0.214","192.168.0.200","TCP","1078","5001  >  59066 [PSH, ACK] Seq=128001 Ack=1 Win=2048 Len=1024"
"199","3.145925","192.168.0.214","192.168.0.200","TCP","1078","5001  >  59066 [PSH, ACK] Seq=129025 Ack=1 Win=2048 Len=1024"
"200","3.146996","192.168.0.214","192.168.0.200","TCP","1078","5001  >  59066 [PSH, ACK] Seq=130049 Ack=1 Win=2048 Len=1024"
"252","5.762180","192.168.0.214","192.168.0.200","TCP","1078","5001  >  59066 [PSH, ACK] Seq=133121 Ack=1 Win=2048 Len=1024"
"253","5.763231","192.168.0.214","192.168.0.200","TCP","1078","5001  >  59066 [PSH, ACK] Seq=134145 Ack=1 Win=2048 Len=1024"
"255","5.764394","192.168.0.214","192.168.0.200","TCP","1078","5001  >  59066 [PSH, ACK] Seq=135169 Ack=1 Win=2048 Len=1024"
"256","5.765484","192.168.0.214","192.168.0.200","TCP","1078","5001  >  59066 [PSH, ACK] Seq=136193 Ack=1 Win=2048 Len=1024"
"258","5.766673","192.168.0.214","192.168.0.200","TCP","1078","5001  >  59066 [PSH, ACK] Seq=137217 Ack=1 Win=2048 Len=1024"
"259","5.767720","192.168.0.214","192.168.0.200","TCP","1078","5001  >  59066 [PSH, ACK] Seq=138241 Ack=1 Win=2048 Len=1024"
"261","5.768856","192.168.0.214","192.168.0.200","TCP","1078","5001  >  59066 [PSH, ACK] Seq=139265 Ack=1 Win=2048 Len=1024"
"262","5.769940","192.168.0.214","192.168.0.200","TCP","1078","5001  >  59066 [PSH, ACK] Seq=140289 Ack=1 Win=2048 Len=1024"
"264","5.771069","192.168.0.214","192.168.0.200","TCP","1078","5001  >  59066 [PSH, ACK] Seq=141313 Ack=1 Win=2048 Len=1024"
"265","5.772115","192.168.0.214","192.168.0.200","TCP","1078","5001  >  59066 [PSH, ACK] Seq=142337 Ack=1 Win=2048 Len=1024"
"267","5.773279","192.168.0.214","192.168.0.200","TCP","1078","5001  >  59066 [PSH, ACK] Seq=143361 Ack=1 Win=2048 Len=1024"
"268","5.774338","192.168.0.214","192.168.0.200","TCP","1078","5001  >  59066 [PSH, ACK] Seq=144385 Ack=1 Win=2048 Len=1024"
"270","5.775528","192.168.0.214","192.168.0.200","TCP","1078","5001  >  59066 [PSH, ACK] Seq=145409 Ack=1 Win=2048 Len=1024"
"271","5.776552","192.168.0.214","192.168.0.200","TCP","1078","5001  >  59066 [PSH, ACK] Seq=146433 Ack=1 Win=2048 Len=1024"
"273","5.777675","192.168.0.214","192.168.0.200","TCP","1078","5001  >  59066 [PSH, ACK] Seq=147457 Ack=1 Win=2048 Len=1024"
"274","5.778742","192.168.0.214","192.168.0.200","TCP","1078","5001  >  59066 [PSH, ACK] Seq=148481 Ack=1 Win=2048 Len=1024"
"276","5.779868","192.168.0.214","192.168.0.200","TCP","1078","5001  >  59066 [PSH, ACK] Seq=149505 Ack=1 Win=2048 Len=1024"
"277","5.780930","192.168.0.214","192.168.0.200","TCP","1078","5001  >  59066 [PSH, ACK] Seq=150529 Ack=1 Win=2048 Len=1024"
"279","5.782076","192.168.0.214","192.168.0.200","TCP","1078","5001  >  59066 [PSH, ACK] Seq=151553 Ack=1 Win=2048 Len=1024"
"280","5.783134","192.168.0.214","192.168.0.200","TCP","1078","5001  >  59066 [PSH, ACK] Seq=152577 Ack=1 Win=2048 Len=1024"
"282","5.784268","192.168.0.214","192.168.0.200","TCP","1078","5001  >  59066 [PSH, ACK] Seq=153601 Ack=1 Win=2048 Len=1024"
"283","5.785346","192.168.0.214","192.168.0.200","TCP","1078","5001  >  59066 [PSH, ACK] Seq=154625 Ack=1 Win=2048 Len=1024"
"285","5.786483","192.168.0.214","192.168.0.200","TCP","1078","5001  >  59066 [PSH, ACK] Seq=155649 Ack=1 Win=2048 Len=1024"
"286","5.787530","192.168.0.214","192.168.0.200","TCP","1078","5001  >  59066 [PSH, ACK] Seq=156673 Ack=1 Win=2048 Len=1024"
"288","5.788697","192.168.0.214","192.168.0.200","TCP","1078","5001  >  59066 [PSH, ACK] Seq=157697 Ack=1 Win=2048 Len=1024"
"289","5.789740","192.168.0.214","192.168.0.200","TCP","1078","5001  >  59066 [PSH, ACK] Seq=158721 Ack=1 Win=2048 Len=1024"
"291","5.790886","192.168.0.214","192.168.0.200","TCP","1078","5001  >  59066 [PSH, ACK] Seq=159745 Ack=1 Win=2048 Len=1024"
"292","5.791940","192.168.0.214","192.168.0.200","TCP","1078","5001  >  59066 [PSH, ACK] Seq=160769 Ack=1 Win=2048 Len=1024"
"294","5.793074","192.168.0.214","192.168.0.200","TCP","1078","5001  >  59066 [PSH, ACK] Seq=161793 Ack=1 Win=2048 Len=1024"
"295","5.794146","192.168.0.214","192.168.0.200","TCP","1078","5001  >  59066 [PSH, ACK] Seq=162817 Ack=1 Win=2048 Len=1024"
"297","5.795279","192.168.0.214","192.168.0.200","TCP","1078","5001  >  59066 [PSH, ACK] Seq=163841 Ack=1 Win=2048 Len=1024"
"298","5.796349","192.168.0.214","192.168.0.200","TCP","1078","5001  >  59066 [PSH, ACK] Seq=164865 Ack=1 Win=2048 Len=1024"
"300","5.797477","192.168.0.214","192.168.0.200","TCP","1078","5001  >  59066 [PSH, ACK] Seq=165889 Ack=1 Win=2048 Len=1024"
"301","5.798545","192.168.0.214","192.168.0.200","TCP","1078","5001  >  59066 [PSH, ACK] Seq=166913 Ack=1 Win=2048 Len=1024"
"303","5.799697","192.168.0.214","192.168.0.200","TCP","1078","5001  >  59066 [PSH, ACK] Seq=167937 Ack=1 Win=2048 Len=1024"
"304","5.800738","192.168.0.214","192.168.0.200","TCP","1078","5001  >  59066 [PSH, ACK] Seq=168961 Ack=1 Win=2048 Len=1024"
"306","5.801881","192.168.0.214","192.168.0.200","TCP","1078","5001  >  59066 [PSH, ACK] Seq=169985 Ack=1 Win=2048 Len=1024"
"307","5.802942","192.168.0.214","192.168.0.200","TCP","1078","5001  >  59066 [PSH, ACK] Seq=171009 Ack=1 Win=2048 Len=1024"
"309","5.804096","192.168.0.214","192.168.0.200","TCP","1078","5001  >  59066 [PSH, ACK] Seq=172033 Ack=1 Win=2048 Len=1024"
"310","5.805150","192.168.0.214","192.168.0.200","TCP","1078","5001  >  59066 [PSH, ACK] Seq=173057 Ack=1 Win=2048 Len=1024"
"312","5.806303","192.168.0.214","192.168.0.200","TCP","1078","5001  >  59066 [PSH, ACK] Seq=174081 Ack=1 Win=2048 Len=1024"
"313","5.807343","192.168.0.214","192.168.0.200","TCP","1078","5001  >  59066 [PSH, ACK] Seq=175105 Ack=1 Win=2048 Len=1024"
"315","5.808486","192.168.0.214","192.168.0.200","TCP","1078","5001  >  59066 [PSH, ACK] Seq=176129 Ack=1 Win=2048 Len=1024"
"316","5.809548","192.168.0.214","192.168.0.200","TCP","1078","5001  >  59066 [PSH, ACK] Seq=177153 Ack=1 Win=2048 Len=1024"
"318","5.810699","192.168.0.214","192.168.0.200","TCP","1078","5001  >  59066 [PSH, ACK] Seq=178177 Ack=1 Win=2048 Len=1024"
"319","5.811753","192.168.0.214","192.168.0.200","TCP","1078","5001  >  59066 [PSH, ACK] Seq=179201 Ack=1 Win=2048 Len=1024"
"321","5.812897","192.168.0.214","192.168.0.200","TCP","1078","5001  >  59066 [PSH, ACK] Seq=180225 Ack=1 Win=2048 Len=1024"
"322","5.813973","192.168.0.214","192.168.0.200","TCP","1078","5001  >  59066 [PSH, ACK] Seq=181249 Ack=1 Win=2048 Len=1024"
"324","5.815104","192.168.0.214","192.168.0.200","TCP","1078","5001  >  59066 [PSH, ACK] Seq=182273 Ack=1 Win=2048 Len=1024"
"325","5.816149","192.168.0.214","192.168.0.200","TCP","1078","5001  >  59066 [PSH, ACK] Seq=183297 Ack=1 Win=2048 Len=1024"
"327","5.817312","192.168.0.214","192.168.0.200","TCP","1078","5001  >  59066 [PSH, ACK] Seq=184321 Ack=1 Win=2048 Len=1024"
"328","5.818354","192.168.0.214","192.168.0.200","TCP","1078","5001  >  59066 [PSH, ACK] Seq=185345 Ack=1 Win=2048 Len=1024"
"330","5.819499","192.168.0.214","192.168.0.200","TCP","1078","5001  >  59066 [PSH, ACK] Seq=186369 Ack=1 Win=2048 Len=1024"
"331","5.820557","192.168.0.214","192.168.0.200","TCP","1078","5001  >  59066 [PSH, ACK] Seq=187393 Ack=1 Win=2048 Len=1024"
"333","5.821721","192.168.0.214","192.168.0.200","TCP","1078","5001  >  59066 [PSH, ACK] Seq=188417 Ack=1 Win=2048 Len=1024"
"334","5.822759","192.168.0.214","192.168.0.200","TCP","1078","5001  >  59066 [PSH, ACK] Seq=189441 Ack=1 Win=2048 Len=1024"
"336","5.823904","192.168.0.214","192.168.0.200","TCP","1078","5001  >  59066 [PSH, ACK] Seq=190465 Ack=1 Win=2048 Len=1024"
"337","5.824977","192.168.0.214","192.168.0.200","TCP","1078","5001  >  59066 [PSH, ACK] Seq=191489 Ack=1 Win=2048 Len=1024"
"339","5.826102","192.168.0.214","192.168.0.200","TCP","1078","5001  >  59066 [PSH, ACK] Seq=192513 Ack=1 Win=2048 Len=1024"
"340","5.827177","192.168.0.214","192.168.0.200","TCP","1078","5001  >  59066 [PSH, ACK] Seq=193537 Ack=1 Win=2048 Len=1024"
"342","5.828306","192.168.0.214","192.168.0.200","TCP","1078","5001  >  59066 [PSH, ACK] Seq=194561 Ack=1 Win=2048 Len=1024"
"343","5.829367","192.168.0.214","192.168.0.200","TCP","1078","5001  >  59066 [PSH, ACK] Seq=195585 Ack=1 Win=2048 Len=1024"
"345","5.830513","192.168.0.214","192.168.0.200","TCP","1078","5001  >  59066 [PSH, ACK] Seq=196609 Ack=1 Win=2048 Len=1024"
"1215","47.874043","192.168.0.214","192.168.0.200","TCP","1078","5001  >  59066 [PSH, ACK] Seq=199681 Ack=1 Win=2048 Len=1024"
"1216","47.875118","192.168.0.214","192.168.0.200","TCP","1078","5001  >  59066 [PSH, ACK] Seq=200705 Ack=1 Win=2048 Len=1024"
"1218","47.876361","192.168.0.214","192.168.0.200","TCP","1078","5001  >  59066 [PSH, ACK] Seq=201729 Ack=1 Win=2048 Len=1024"
"1219","47.877397","192.168.0.214","192.168.0.200","TCP","1078","5001  >  59066 [PSH, ACK] Seq=202753 Ack=1 Win=2048 Len=1024"
"1221","47.878627","192.168.0.214","192.168.0.200","TCP","1078","5001  >  59066 [PSH, ACK] Seq=203777 Ack=1 Win=2048 Len=1024"
"1222","47.879646","192.168.0.214","192.168.0.200","TCP","1078","5001  >  59066 [PSH, ACK] Seq=204801 Ack=1 Win=2048 Len=1024"
"1224","47.880783","192.168.0.214","192.168.0.200","TCP","1078","5001  >  59066 [PSH, ACK] Seq=205825 Ack=1 Win=2048 Len=1024"
"1225","47.881820","192.168.0.214","192.168.0.200","TCP","1078","5001  >  59066 [PSH, ACK] Seq=206849 Ack=1 Win=2048 Len=1024"
"1227","47.882967","192.168.0.214","192.168.0.200","TCP","1078","5001  >  59066 [PSH, ACK] Seq=207873 Ack=1 Win=2048 Len=1024"
"1228","47.884015","192.168.0.214","192.168.0.200","TCP","1078","5001  >  59066 [PSH, ACK] Seq=208897 Ack=1 Win=2048 Len=1024"
"1230","47.885177","192.168.0.214","192.168.0.200","TCP","1078","5001  >  59066 [PSH, ACK] Seq=209921 Ack=1 Win=2048 Len=1024"
"1231","47.886217","192.168.0.214","192.168.0.200","TCP","1078","5001  >  59066 [PSH, ACK] Seq=210945 Ack=1 Win=2048 Len=1024"
"1233","47.887383","192.168.0.214","192.168.0.200","TCP","1078","5001  >  59066 [PSH, ACK] Seq=211969 Ack=1 Win=2048 Len=1024"
"1234","47.888427","192.168.0.214","192.168.0.200","TCP","1078","5001  >  59066 [PSH, ACK] Seq=212993 Ack=1 Win=2048 Len=1024"
"1236","47.889571","192.168.0.214","192.168.0.200","TCP","1078","5001  >  59066 [PSH, ACK] Seq=214017 Ack=1 Win=2048 Len=1024"
"1237","47.890631","192.168.0.214","192.168.0.200","TCP","1078","5001  >  59066 [PSH, ACK] Seq=215041 Ack=1 Win=2048 Len=1024"
"1239","47.891772","192.168.0.214","192.168.0.200","TCP","1078","5001  >  59066 [PSH, ACK] Seq=216065 Ack=1 Win=2048 Len=1024"
"1240","47.892829","192.168.0.214","192.168.0.200","TCP","1078","5001  >  59066 [PSH, ACK] Seq=217089 Ack=1 Win=2048 Len=1024"
"1242","47.893971","192.168.0.214","192.168.0.200","TCP","1078","5001  >  59066 [PSH, ACK] Seq=218113 Ack=1 Win=2048 Len=1024"
"1243","47.895047","192.168.0.214","192.168.0.200","TCP","1078","5001  >  59066 [PSH, ACK] Seq=219137 Ack=1 Win=2048 Len=1024"
"1245","47.896189","192.168.0.214","192.168.0.200","TCP","1078","5001  >  59066 [PSH, ACK] Seq=220161 Ack=1 Win=2048 Len=1024"
"1246","47.897241","192.168.0.214","192.168.0.200","TCP","1078","5001  >  59066 [PSH, ACK] Seq=221185 Ack=1 Win=2048 Len=1024"
"1248","47.898377","192.168.0.214","192.168.0.200","TCP","1078","5001  >  59066 [PSH, ACK] Seq=222209 Ack=1 Win=2048 Len=1024"
"1249","47.899448","192.168.0.214","192.168.0.200","TCP","1078","5001  >  59066 [PSH, ACK] Seq=223233 Ack=1 Win=2048 Len=1024"
"1251","47.900573","192.168.0.214","192.168.0.200","TCP","1078","5001  >  59066 [PSH, ACK] Seq=224257 Ack=1 Win=2048 Len=1024"
"1252","47.901631","192.168.0.214","192.168.0.200","TCP","1078","5001  >  59066 [PSH, ACK] Seq=225281 Ack=1 Win=2048 Len=1024"
"1254","47.902776","192.168.0.214","192.168.0.200","TCP","1078","5001  >  59066 [PSH, ACK] Seq=226305 Ack=1 Win=2048 Len=1024"
"1255","47.903841","192.168.0.214","192.168.0.200","TCP","1078","5001  >  59066 [PSH, ACK] Seq=227329 Ack=1 Win=2048 Len=1024"
"1257","47.904991","192.168.0.214","192.168.0.200","TCP","1078","5001  >  59066 [PSH, ACK] Seq=228353 Ack=1 Win=2048 Len=1024"
"1258","47.906027","192.168.0.214","192.168.0.200","TCP","1078","5001  >  59066 [PSH, ACK] Seq=229377 Ack=1 Win=2048 Len=1024"
"1260","47.907185","192.168.0.214","192.168.0.200","TCP","1078","5001  >  59066 [PSH, ACK] Seq=230401 Ack=1 Win=2048 Len=1024"
"1261","47.908246","192.168.0.214","192.168.0.200","TCP","1078","5001  >  59066 [PSH, ACK] Seq=231425 Ack=1 Win=2048 Len=1024"
"1263","47.909373","192.168.0.214","192.168.0.200","TCP","1078","5001  >  59066 [PSH, ACK] Seq=232449 Ack=1 Win=2048 Len=1024"
"1264","47.910432","192.168.0.214","192.168.0.200","TCP","1078","5001  >  59066 [PSH, ACK] Seq=233473 Ack=1 Win=2048 Len=1024"
"1266","47.911583","192.168.0.214","192.168.0.200","TCP","1078","5001  >  59066 [PSH, ACK] Seq=234497 Ack=1 Win=2048 Len=1024"
"1267","47.912630","192.168.0.214","192.168.0.200","TCP","1078","5001  >  59066 [PSH, ACK] Seq=235521 Ack=1 Win=2048 Len=1024"
"1269","47.913800","192.168.0.214","192.168.0.200","TCP","1078","5001  >  59066 [PSH, ACK] Seq=236545 Ack=1 Win=2048 Len=1024"
"1270","47.914841","192.168.0.214","192.168.0.200","TCP","1078","5001  >  59066 [PSH, ACK] Seq=237569 Ack=1 Win=2048 Len=1024"
"1272","47.915975","192.168.0.214","192.168.0.200","TCP","1078","5001  >  59066 [PSH, ACK] Seq=238593 Ack=1 Win=2048 Len=1024"
"1273","47.917057","192.168.0.214","192.168.0.200","TCP","1078","5001  >  59066 [PSH, ACK] Seq=239617 Ack=1 Win=2048 Len=1024"
"1275","47.918197","192.168.0.214","192.168.0.200","TCP","1078","5001  >  59066 [PSH, ACK] Seq=240641 Ack=1 Win=2048 Len=1024"
"1276","47.919248","192.168.0.214","192.168.0.200","TCP","1078","5001  >  59066 [PSH, ACK] Seq=241665 Ack=1 Win=2048 Len=1024"
"1278","47.920383","192.168.0.214","192.168.0.200","TCP","1078","5001  >  59066 [PSH, ACK] Seq=242689 Ack=1 Win=2048 Len=1024"
"1279","47.921464","192.168.0.214","192.168.0.200","TCP","1078","5001  >  59066 [PSH, ACK] Seq=243713 Ack=1 Win=2048 Len=1024"
"1281","47.922586","192.168.0.214","192.168.0.200","TCP","1078","5001  >  59066 [PSH, ACK] Seq=244737 Ack=1 Win=2048 Len=1024"
"1282","47.923654","192.168.0.214","192.168.0.200","TCP","1078","5001  >  59066 [PSH, ACK] Seq=245761 Ack=1 Win=2048 Len=1024"
"1284","47.924775","192.168.0.214","192.168.0.200","TCP","1078","5001  >  59066 [PSH, ACK] Seq=246785 Ack=1 Win=2048 Len=1024"
"1285","47.925853","192.168.0.214","192.168.0.200","TCP","1078","5001  >  59066 [PSH, ACK] Seq=247809 Ack=1 Win=2048 Len=1024"
"1287","47.927112","192.168.0.214","192.168.0.200","TCP","1078","5001  >  59066 [PSH, ACK] Seq=248833 Ack=1 Win=2048 Len=1024"
"1288","47.928148","192.168.0.214","192.168.0.200","TCP","1078","5001  >  59066 [PSH, ACK] Seq=249857 Ack=1 Win=2048 Len=1024"
"1290","47.929275","192.168.0.214","192.168.0.200","TCP","1078","5001  >  59066 [PSH, ACK] Seq=250881 Ack=1 Win=2048 Len=1024"
"1291","47.930330","192.168.0.214","192.168.0.200","TCP","1078","5001  >  59066 [PSH, ACK] Seq=251905 Ack=1 Win=2048 Len=1024"
"1293","47.931466","192.168.0.214","192.168.0.200","TCP","1078","5001  >  59066 [PSH, ACK] Seq=252929 Ack=1 Win=2048 Len=1024"
"1294","47.932523","192.168.0.214","192.168.0.200","TCP","1078","5001  >  59066 [PSH, ACK] Seq=253953 Ack=1 Win=2048 Len=1024"
"1296","47.933682","192.168.0.214","192.168.0.200","TCP","1078","5001  >  59066 [PSH, ACK] Seq=254977 Ack=1 Win=2048 Len=1024"
"1297","47.934721","192.168.0.214","192.168.0.200","TCP","1078","5001  >  59066 [PSH, ACK] Seq=256001 Ack=1 Win=2048 Len=1024"
"1299","47.935889","192.168.0.214","192.168.0.200","TCP","1078","5001  >  59066 [PSH, ACK] Seq=257025 Ack=1 Win=2048 Len=1024"
"1300","47.936947","192.168.0.214","192.168.0.200","TCP","1078","5001  >  59066 [PSH, ACK] Seq=258049 Ack=1 Win=2048 Len=1024"
"1302","47.938066","192.168.0.214","192.168.0.200","TCP","1078","5001  >  59066 [PSH, ACK] Seq=259073 Ack=1 Win=2048 Len=1024"
"1303","47.939144","192.168.0.214","192.168.0.200","TCP","1078","5001  >  59066 [PSH, ACK] Seq=260097 Ack=1 Win=2048 Len=1024"
"1305","47.940279","192.168.0.214","192.168.0.200","TCP","1078","5001  >  59066 [PSH, ACK] Seq=261121 Ack=1 Win=2048 Len=1024"
"1409","53.042907","192.168.0.214","192.168.0.200","TCP","1078","5001  >  59066 [PSH, ACK] Seq=264193 Ack=1 Win=2048 Len=1024"
"1411","53.044076","192.168.0.214","192.168.0.200","TCP","1078","5001  >  59066 [PSH, ACK] Seq=265217 Ack=1 Win=2048 Len=1024"
"1412","53.045140","192.168.0.214","192.168.0.200","TCP","1078","5001  >  59066 [PSH, ACK] Seq=266241 Ack=1 Win=2048 Len=1024"
"1414","53.046296","192.168.0.214","192.168.0.200","TCP","1078","5001  >  59066 [PSH, ACK] Seq=267265 Ack=1 Win=2048 Len=1024"
"1415","53.047397","192.168.0.214","192.168.0.200","TCP","1078","5001  >  59066 [PSH, ACK] Seq=268289 Ack=1 Win=2048 Len=1024"
"1417","53.048632","192.168.0.214","192.168.0.200","TCP","1078","5001  >  59066 [PSH, ACK] Seq=269313 Ack=1 Win=2048 Len=1024"
"1418","53.049697","192.168.0.214","192.168.0.200","TCP","1078","5001  >  59066 [PSH, ACK] Seq=270337 Ack=1 Win=2048 Len=1024"
"1420","53.050913","192.168.0.214","192.168.0.200","TCP","1078","5001  >  59066 [PSH, ACK] Seq=271361 Ack=1 Win=2048 Len=1024"
"1421","53.051967","192.168.0.214","192.168.0.200","TCP","1078","5001  >  59066 [PSH, ACK] Seq=272385 Ack=1 Win=2048 Len=1024"
"1423","53.053206","192.168.0.214","192.168.0.200","TCP","1078","5001  >  59066 [PSH, ACK] Seq=273409 Ack=1 Win=2048 Len=1024"
"1424","53.054215","192.168.0.214","192.168.0.200","TCP","1078","5001  >  59066 [PSH, ACK] Seq=274433 Ack=1 Win=2048 Len=1024"
"1426","53.055323","192.168.0.214","192.168.0.200","TCP","1078","5001  >  59066 [PSH, ACK] Seq=275457 Ack=1 Win=2048 Len=1024"
"1427","53.056420","192.168.0.214","192.168.0.200","TCP","1078","5001  >  59066 [PSH, ACK] Seq=276481 Ack=1 Win=2048 Len=1024"
"1429","53.057570","192.168.0.214","192.168.0.200","TCP","1078","5001  >  59066 [PSH, ACK] Seq=277505 Ack=1 Win=2048 Len=1024"
"1430","53.058584","192.168.0.214","192.168.0.200","TCP","1078","5001  >  59066 [PSH, ACK] Seq=278529 Ack=1 Win=2048 Len=1024"
"1432","53.059741","192.168.0.214","192.168.0.200","TCP","1078","5001  >  59066 [PSH, ACK] Seq=279553 Ack=1 Win=2048 Len=1024"
"1433","53.060804","192.168.0.214","192.168.0.200","TCP","1078","5001  >  59066 [PSH, ACK] Seq=280577 Ack=1 Win=2048 Len=1024"
"1435","53.061950","192.168.0.214","192.168.0.200","TCP","1078","5001  >  59066 [PSH, ACK] Seq=281601 Ack=1 Win=2048 Len=1024"
"1436","53.063010","192.168.0.214","192.168.0.200","TCP","1078","5001  >  59066 [PSH, ACK] Seq=282625 Ack=1 Win=2048 Len=1024"
"1438","53.064156","192.168.0.214","192.168.0.200","TCP","1078","5001  >  59066 [PSH, ACK] Seq=283649 Ack=1 Win=2048 Len=1024"
"1439","53.065203","192.168.0.214","192.168.0.200","TCP","1078","5001  >  59066 [PSH, ACK] Seq=284673 Ack=1 Win=2048 Len=1024"
"1441","53.066350","192.168.0.214","192.168.0.200","TCP","1078","5001  >  59066 [PSH, ACK] Seq=285697 Ack=1 Win=2048 Len=1024"
"1442","53.067393","192.168.0.214","192.168.0.200","TCP","1078","5001  >  59066 [PSH, ACK] Seq=286721 Ack=1 Win=2048 Len=1024"
"1444","53.068536","192.168.0.214","192.168.0.200","TCP","1078","5001  >  59066 [PSH, ACK] Seq=287745 Ack=1 Win=2048 Len=1024"
"1445","53.069569","192.168.0.214","192.168.0.200","TCP","1078","5001  >  59066 [PSH, ACK] Seq=288769 Ack=1 Win=2048 Len=1024"
"1447","53.070714","192.168.0.214","192.168.0.200","TCP","1078","5001  >  59066 [PSH, ACK] Seq=289793 Ack=1 Win=2048 Len=1024"
"1448","53.071767","192.168.0.214","192.168.0.200","TCP","1078","5001  >  59066 [PSH, ACK] Seq=290817 Ack=1 Win=2048 Len=1024"
"1450","53.072923","192.168.0.214","192.168.0.200","TCP","1078","5001  >  59066 [PSH, ACK] Seq=291841 Ack=1 Win=2048 Len=1024"
"1451","53.073980","192.168.0.214","192.168.0.200","TCP","1078","5001  >  59066 [PSH, ACK] Seq=292865 Ack=1 Win=2048 Len=1024"
"1453","53.075120","192.168.0.214","192.168.0.200","TCP","1078","5001  >  59066 [PSH, ACK] Seq=293889 Ack=1 Win=2048 Len=1024"
"1454","53.076154","192.168.0.214","192.168.0.200","TCP","1078","5001  >  59066 [PSH, ACK] Seq=294913 Ack=1 Win=2048 Len=1024"
"1456","53.077312","192.168.0.214","192.168.0.200","TCP","1078","5001  >  59066 [PSH, ACK] Seq=295937 Ack=1 Win=2048 Len=1024"
"1457","53.078370","192.168.0.214","192.168.0.200","TCP","1078","5001  >  59066 [PSH, ACK] Seq=296961 Ack=1 Win=2048 Len=1024"
"1459","53.079514","192.168.0.214","192.168.0.200","TCP","1078","5001  >  59066 [PSH, ACK] Seq=297985 Ack=1 Win=2048 Len=1024"
"1460","53.080570","192.168.0.214","192.168.0.200","TCP","1078","5001  >  59066 [PSH, ACK] Seq=299009 Ack=1 Win=2048 Len=1024"
"1462","53.081721","192.168.0.214","192.168.0.200","TCP","1078","5001  >  59066 [PSH, ACK] Seq=300033 Ack=1 Win=2048 Len=1024"
"1463","53.082791","192.168.0.214","192.168.0.200","TCP","1078","5001  >  59066 [PSH, ACK] Seq=301057 Ack=1 Win=2048 Len=1024"
"1465","53.083916","192.168.0.214","192.168.0.200","TCP","1078","5001  >  59066 [PSH, ACK] Seq=302081 Ack=1 Win=2048 Len=1024"
"1466","53.084969","192.168.0.214","192.168.0.200","TCP","1078","5001  >  59066 [PSH, ACK] Seq=303105 Ack=1 Win=2048 Len=1024"
"1468","53.086114","192.168.0.214","192.168.0.200","TCP","1078","5001  >  59066 [PSH, ACK] Seq=304129 Ack=1 Win=2048 Len=1024"
"1469","53.087186","192.168.0.214","192.168.0.200","TCP","1078","5001  >  59066 [PSH, ACK] Seq=305153 Ack=1 Win=2048 Len=1024"
"1471","53.088318","192.168.0.214","192.168.0.200","TCP","1078","5001  >  59066 [PSH, ACK] Seq=306177 Ack=1 Win=2048 Len=1024"
"1472","53.089388","192.168.0.214","192.168.0.200","TCP","1078","5001  >  59066 [PSH, ACK] Seq=307201 Ack=1 Win=2048 Len=1024"
"1474","53.090525","192.168.0.214","192.168.0.200","TCP","1078","5001  >  59066 [PSH, ACK] Seq=308225 Ack=1 Win=2048 Len=1024"
"1475","53.091570","192.168.0.214","192.168.0.200","TCP","1078","5001  >  59066 [PSH, ACK] Seq=309249 Ack=1 Win=2048 Len=1024"
"1477","53.092724","192.168.0.214","192.168.0.200","TCP","1078","5001  >  59066 [PSH, ACK] Seq=310273 Ack=1 Win=2048 Len=1024"
"1478","53.093771","192.168.0.214","192.168.0.200","TCP","1078","5001  >  59066 [PSH, ACK] Seq=311297 Ack=1 Win=2048 Len=1024"
"1480","53.094910","192.168.0.214","192.168.0.200","TCP","1078","5001  >  59066 [PSH, ACK] Seq=312321 Ack=1 Win=2048 Len=1024"
"1481","53.095964","192.168.0.214","192.168.0.200","TCP","1078","5001  >  59066 [PSH, ACK] Seq=313345 Ack=1 Win=2048 Len=1024"
"1483","53.097130","192.168.0.214","192.168.0.200","TCP","1078","5001  >  59066 [PSH, ACK] Seq=314369 Ack=1 Win=2048 Len=1024"
"1484","53.098177","192.168.0.214","192.168.0.200","TCP","1078","5001  >  59066 [PSH, ACK] Seq=315393 Ack=1 Win=2048 Len=1024"
"1486","53.099334","192.168.0.214","192.168.0.200","TCP","1078","5001  >  59066 [PSH, ACK] Seq=316417 Ack=1 Win=2048 Len=1024"
"1487","53.100376","192.168.0.214","192.168.0.200","TCP","1078","5001  >  59066 [PSH, ACK] Seq=317441 Ack=1 Win=2048 Len=1024"
"1489","53.101525","192.168.0.214","192.168.0.200","TCP","1078","5001  >  59066 [PSH, ACK] Seq=318465 Ack=1 Win=2048 Len=1024"
"1490","53.102578","192.168.0.214","192.168.0.200","TCP","1078","5001  >  59066 [PSH, ACK] Seq=319489 Ack=1 Win=2048 Len=1024"
"1492","53.103719","192.168.0.214","192.168.0.200","TCP","1078","5001  >  59066 [PSH, ACK] Seq=320513 Ack=1 Win=2048 Len=1024"
"1493","53.104804","192.168.0.214","192.168.0.200","TCP","1078","5001  >  59066 [PSH, ACK] Seq=321537 Ack=1 Win=2048 Len=1024"
"1495","53.105918","192.168.0.214","192.168.0.200","TCP","1078","5001  >  59066 [PSH, ACK] Seq=322561 Ack=1 Win=2048 Len=1024"
"1496","53.106977","192.168.0.214","192.168.0.200","TCP","1078","5001  >  59066 [PSH, ACK] Seq=323585 Ack=1 Win=2048 Len=1024"
"1498","53.108122","192.168.0.214","192.168.0.200","TCP","1078","5001  >  59066 [PSH, ACK] Seq=324609 Ack=1 Win=2048 Len=1024"
"1499","53.109177","192.168.0.214","192.168.0.200","TCP","1078","5001  >  59066 [PSH, ACK] Seq=325633 Ack=1 Win=2048 Len=1024"
"1501","53.110321","192.168.0.214","192.168.0.200","TCP","1078","5001  >  59066 [PSH, ACK] Seq=326657 Ack=1 Win=2048 Len=1024"
"1604","58.151043","192.168.0.214","192.168.0.200","TCP","1078","5001  >  59066 [PSH, ACK] Seq=329729 Ack=1 Win=2048 Len=1024"
"1605","58.152084","192.168.0.214","192.168.0.200","TCP","1078","5001  >  59066 [PSH, ACK] Seq=330753 Ack=1 Win=2048 Len=1024"
"1607","58.153305","192.168.0.214","192.168.0.200","TCP","1078","5001  >  59066 [PSH, ACK] Seq=331777 Ack=1 Win=2048 Len=1024"
"1608","58.154357","192.168.0.214","192.168.0.200","TCP","1078","5001  >  59066 [PSH, ACK] Seq=332801 Ack=1 Win=2048 Len=1024"
